{"$schema":"https://json-schema.org/draft/2020-12/schema","title":"Project Supernova Frozen Cohort Control v2.3","type":"object","additionalProperties":false,"required":["control_manifest_id","task_network_plan_id","cohort_id","protocol_version","generation_seq","parent_state_git_identity","purpose","files","calibration_countable","fresh_allowed","mixed_control_revisions_allowed","deep_research_owner","deep_research_inputs"],"properties":{"control_manifest_id":{"type":"string"},"task_network_plan_id":{"const":"61fbe7206e43ec538f310acf875e72865daf8fbb0e4ccbe27dcd6d1a072ff8a0"},"cohort_id":{"type":"string"},"protocol_version":{"const":"2.3"},"generation_seq":{"type":"integer","minimum":1},"parent_state_git_identity":{"type":"string","pattern":"^[0-9a-f]{40}$"},"purpose":{"type":"string"},"files":{"type":"object","additionalProperties":{"type":"string","pattern":"^[0-9a-f]{40}$"}},"calibration_countable":{"type":"boolean"},"fresh_allowed":{"type":"boolean"},"mixed_control_revisions_allowed":{"const":false},"deep_research_owner":{"const":"BIL00"},"deep_research_inputs":{"type":"string"}}}
