{
  "control_manifest_id": "CTRL-CAL-BR-005-51f9a310-V23-BR24",
  "task_network_plan_id": "61fbe7206e43ec538f310acf875e72865daf8fbb0e4ccbe27dcd6d1a072ff8a0",
  "cohort_id": "CAL-BR-005-51f9a310",
  "protocol_version": "2.3",
  "generation_seq": 5,
  "parent_state_git_identity": "7fff4d309e587667703d78f2e9635f8cba4f062a",
  "purpose": "Branch-isolated replay-only full-loop calibration. Freeze one immutable generation branch and test per-worker branches -> MM06 verifier branch -> MF06 integrator branch -> one BIL00 consolidation PR. No benchmark/protected evidence.",
  "files": {
    "PROTOCOL.md": "bba1a83e9219bd1728e7af09cc9097fd2ff2e7f0",
    "WORKER_PROTOCOL.md": "4fd7320da0011806fc4ecfa0e2cfa641b13e0dcb",
    "SESSION_STANDARD.md": "b64883a2c4c3a2cfa52bc0434028efa9f82923b1",
    "plan/PLAN.json": "cc401f64a2838edf4ec86d7705bdca798d32e9db",
    "config/roles.json": "ef2e1954ef64cd2b73b4e390c33a98650b1b60f5",
    "config/worker_auth.json": "e8db1782ebf8e18112864d9c710502a18a35721b",
    "benchmark/registry.json": "195542d5dbbdaed8db512f9197579a5bc602eb83",
    "requirements-validation.txt": "3ee1ea1a4270a73d0a83859fefca415177450121",
    "schemas/control.schema.json": "715da0c28634ee8dc4edbd2138a5b755a03f5051",
    "schemas/state.schema.json": "aa2ed6253322ec469280de0b77f2bfecd8bbb6ba",
    "schemas/assignment.schema.json": "58ab2ca2d42d173e3472068560a5b2281e78aa75",
    "schemas/report.schema.json": "8f20f43e862201477c401db3334d2afc06cbeae6",
    "schemas/verification.schema.json": "d2e38cfae93663f109cbfc7dd12fd1370806be9c",
    "schemas/integration.schema.json": "b2fd1c003c1496e1731e190cf4e7785799489084",
    "schemas/director.schema.json": "e770a72f3e5394868dbea10a87335879b9d90f18",
    "schemas/research.schema.json": "3b0f2544decb7c8189caf8714632ef8267aa107a",
    "schemas/benchmark_registry.schema.json": "67954d036c03466950d56a386f5ce50c2d85ebde",
    "schemas/benchmark_completion.schema.json": "a0d5179cab908d348a2ac486fa3c5121b2c2dbce",
    "schemas/private_manifest_contract.schema.json": "05ef541391432327d1686f69d3b1646d8a6cbc35",
    "scripts/validate_bus.py": "c35e450fdf132832d2f77f4362609f025a54f262",
    ".github/workflows/validate-bus.yml": "211797feb2f5fa7664da8d36ab0f749eaf47187c",
    "BRANCH_PROTOCOL.md": "1efa5352d0156351e1eaef97cdbc8079d1b90213",
    "branch/CONFIG.json": "6d64a09cf35078168f1a636d2254827dd261dff7",
    "schemas/branch_generation.schema.json": "36cac41c199eee816c2116a9161ba453173ce0d7",
    "schemas/branch_consolidation.schema.json": "fcd45d80d8b50001d1d4f1cf7e61c0696c2533cb"
  },
  "calibration_countable": true,
  "fresh_allowed": false,
  "mixed_control_revisions_allowed": false,
  "deep_research_owner": "BIL00",
  "deep_research_inputs": "MM06-safe and MF06-integrated only"
}
