{
  "control_manifest_id":"CTRL-CAL-BR-007-2672995c-V23-BR241",
  "task_network_plan_id":"61fbe7206e43ec538f310acf875e72865daf8fbb0e4ccbe27dcd6d1a072ff8a0",
  "cohort_id":"CAL-BR-007-2672995c",
  "protocol_version":"2.3",
  "generation_seq":7,
  "parent_state_git_identity":"2672995c4ee9209bae72dbaedc72799d1ff78528",
  "purpose":"Clean branch-isolated replay-only full-loop calibration after diagnostics CAL-BR-005 and CAL-BR-006. Exact closed v2.3 control schema, exact base-21 plus overlay-6 frozen file set, strict assignment-phase session headers, per-worker branches, independent MM06 reread, MF06 integration, and one BIL00 CAS-protected consolidation PR. No fresh/protected benchmark evidence.",
  "files":{
    "PROTOCOL.md":"bba1a83e9219bd1728e7af09cc9097fd2ff2e7f0",
    "WORKER_PROTOCOL.md":"4fd7320da0011806fc4ecfa0e2cfa641b13e0dcb",
    "SESSION_STANDARD.md":"b64883a2c4c3a2cfa52bc0434028efa9f82923b1",
    "plan/PLAN.json":"cc401f64a2838edf4ec86d7705bdca798d32e9db",
    "config/roles.json":"ef2e1954ef64cd2b73b4e390c33a98650b1b60f5",
    "config/worker_auth.json":"e8db1782ebf8e18112864d9c710502a18a35721b",
    "benchmark/registry.json":"195542d5dbbdaed8db512f9197579a5bc602eb83",
    "requirements-validation.txt":"3ee1ea1a4270a73d0a83859fefca415177450121",
    "schemas/control.schema.json":"715da0c28634ee8dc4edbd2138a5b755a03f5051",
    "schemas/state.schema.json":"aa2ed6253322ec469280de0b77f2bfecd8bbb6ba",
    "schemas/assignment.schema.json":"58ab2ca2d42d173e3472068560a5b2281e78aa75",
    "schemas/report.schema.json":"8f20f43e862201477c401db3334d2afc06cbeae6",
    "schemas/verification.schema.json":"d2e38cfae93663f109cbfc7dd12fd1370806be9c",
    "schemas/integration.schema.json":"b2fd1c003c1496e1731e190cf4e7785799489084",
    "schemas/director.schema.json":"e770a72f3e5394868dbea10a87335879b9d90f18",
    "schemas/research.schema.json":"3b0f2544decb7c8189caf8714632ef8267aa107a",
    "schemas/benchmark_registry.schema.json":"67954d036c03466950d56a386f5ce50c2d85ebde",
    "schemas/benchmark_completion.schema.json":"a0d5179cab908d348a2ac486fa3c5121b2c2dbce",
    "schemas/private_manifest_contract.schema.json":"05ef541391432327d1686f69d3b1646d8a6cbc35",
    "scripts/validate_bus.py":"c35e450fdf132832d2f77f4362609f025a54f262",
    ".github/workflows/validate-bus.yml":"211797feb2f5fa7664da8d36ab0f749eaf47187c",
    "BRANCH_PROTOCOL.md":"18616ac7b45391873972bc3e470ab65daefcc93c",
    "branch/CONFIG.json":"6451943a34cd8d5d29e910cc154a72d5af9f7ec1",
    "schemas/branch_generation.schema.json":"36cac41c199eee816c2116a9161ba453173ce0d7",
    "schemas/branch_consolidation.schema.json":"fcd45d80d8b50001d1d4f1cf7e61c0696c2533cb",
    "scripts/validate_branch_bus.py":"de6a4b37b5c54c1fed2b36741cb22ea265d3bde3",
    ".github/workflows/validate-branch-bus.yml":"9740a8e5a86b8e2453ba3e33679d088be1fdcbe3"
  },
  "calibration_countable":true,
  "fresh_allowed":false,
  "mixed_control_revisions_allowed":false,
  "deep_research_owner":"BIL00",
  "deep_research_inputs":"MM06-safe and MF06-integrated only"
}
